{
  "$schema": "https://json-schema.org/draft/2020-12/schema",
  "type": "object",
  "additionalProperties": false,
  "required": ["generated_at", "schema_version", "attribution", "count", "networks"],
  "properties": {
    "generated_at": {"type": "string"},
    "schema_version": {"type": "integer"},
    "attribution": {"type": "string", "maxLength": 1000},
    "count": {"type": "integer", "minimum": 0},
    "total_abusive_ips": {"type": "integer", "minimum": 0},
    "unattributed_ips": {"type": "integer", "minimum": 0},
    "cap": {"type": "integer", "minimum": 0},
    "truncated": {"type": "boolean"},
    "networks": {
      "type": "array",
      "maxItems": 1000,
      "items": {
        "type": "object",
        "additionalProperties": false,
        "required": ["asn", "isp", "ip_count", "report_count", "categories", "sources", "examples"],
        "properties": {
          "asn": {"type": "string", "pattern": "^AS\\d+$", "maxLength": 16},
          "isp": {"type": "string", "minLength": 1, "maxLength": 128},
          "country": {"type": "string", "minLength": 2, "maxLength": 2},
          "ip_count": {"type": "integer", "minimum": 1},
          "report_count": {"type": "integer", "minimum": 0},
          "categories": {
            "type": "array", "maxItems": 10,
            "items": {"enum": ["brute-force","ssh","port-scan","web-app-attack","phishing","malware-c2","scanner","spam","exploited-host","other"]}
          },
          "sources": {
            "type": "array", "minItems": 1, "maxItems": 3,
            "items": {"enum": ["community", "abuse.ch"]}
          },
          "examples": {
            "type": "array", "maxItems": 5,
            "items": {"type": "string", "minLength": 3, "maxLength": 45}
          }
        }
      }
    }
  }
}
