{"generated_at":"2026-10-20T12:07:30Z","schema_version":1,"attribution":"Networks (ASN / ISP) ranked by the volume of abusive IPs reported to SOCDesk (community, owner-moderated) and published on the abuse.ch Feodo Tracker / ThreatFox blocklists. A count of reported/blocklisted IPs hosted on a network — NOT a verdict on the network or its operator. ASN/ISP mapping by IPinfo (https://ipinfo.io); a report is an allegation reviewed before publication, not a confirmation.","count":5,"total_abusive_ips":8,"unattributed_ips":0,"cap":200,"truncated":false,"networks":[{"asn":"AS14061","isp":"DigitalOcean, LLC","ip_count":2,"report_count":0,"categories":[],"sources":["abuse.ch"],"examples":["162.243.103.246","178.62.3.223"],"country":"GB"},{"asn":"AS14618","isp":"Amazon.com, Inc.","ip_count":2,"report_count":0,"categories":[],"sources":["abuse.ch"],"examples":["34.204.119.63","50.16.16.211"],"country":"US"},{"asn":"AS60729","isp":"Stiftung Erneuerbare Freiheit","ip_count":2,"report_count":2,"categories":["phishing"],"sources":["community"],"examples":["185.220.101.34","185.220.101.42"],"country":"DE"},{"asn":"AS57269","isp":"DIGI SPAIN TELECOM S.A","ip_count":1,"report_count":1,"categories":["phishing"],"sources":["community"],"examples":["86.127.230.16"],"country":"ES"},{"asn":"AS9370","isp":"SAKURA Internet Inc.","ip_count":1,"report_count":0,"categories":[],"sources":["abuse.ch"],"examples":["27.133.154.218"],"country":"JP"}]}